{
  "coverageId": "problem-evidence-phase1-v2-behavior-coverage",
  "schemaVersion": "2.0.0-draft",
  "reviewStatus": "human-review-required",
  "humanReviewed": false,
  "reviewedBy": null,
  "reviewedDate": null,
  "externalAuthorityRequired": true,
  "externalAuthorityManifest": null,
  "sourcePolicyId": "problem-evidence-phase1-benchmark-policy",
  "sourcePolicySchemaVersion": "1.0.0",
  "statementCounts": {
    "notYetAutomated": 87,
    "humanOnly": 0,
    "total": 87
  },
  "mappings": [
    {
      "fixture": "contradictory-evidence.json",
      "requirements": [
        {
          "requirementId": "REQ-1",
          "statements": [
            {
              "statementType": "requiredVerificationBehavior",
              "statement": "Use independent application of the written segment definition to real or borderline companies to surface undecidable boundaries.",
              "classification": "not-yet-automated",
              "ruleIds": [],
              "semanticCriteriaIds": [
                "segment.definition.boundary"
              ],
              "humanReviewRequired": true,
              "humanReviewQuestion": "Does the generated attempt evidence satisfy the approved policy statement through the mapped criteria (segment.definition.boundary) without relying on prohibited substitutions? Statement: Use independent application of the written segment definition to real or borderline companies to surface undecidable boundaries.",
              "automationBoundary": "Temporarily not automated. This statement has not yet been assessed for deterministic automation eligibility; human-only is reserved for statements later judged permanently ineligible."
            },
            {
              "statementType": "requiredVerificationBehavior",
              "statement": "Treat disagreement in sorting as evidence that the segment definition needs refinement.",
              "classification": "not-yet-automated",
              "ruleIds": [],
              "semanticCriteriaIds": [
                "segment.definition.boundary"
              ],
              "humanReviewRequired": true,
              "humanReviewQuestion": "Does the generated attempt evidence satisfy the approved policy statement through the mapped criteria (segment.definition.boundary) without relying on prohibited substitutions? Statement: Treat disagreement in sorting as evidence that the segment definition needs refinement.",
              "automationBoundary": "Temporarily not automated. This statement has not yet been assessed for deterministic automation eligibility; human-only is reserved for statements later judged permanently ineligible."
            },
            {
              "statementType": "prohibitedSubstitution",
              "statement": "Do not recommend market sizing, product demand testing, or more general interviews as a substitute for definition application.",
              "classification": "not-yet-automated",
              "ruleIds": [],
              "semanticCriteriaIds": [
                "segment.definition.boundary",
                "commitment.resource.records",
                "claim.replacement.open07"
              ],
              "humanReviewRequired": true,
              "humanReviewQuestion": "Does the generated attempt evidence satisfy the approved policy statement through the mapped criteria (segment.definition.boundary, commitment.resource.records, claim.replacement.open07) without relying on prohibited substitutions? Statement: Do not recommend market sizing, product demand testing, or more general interviews as a substitute for definition application.",
              "automationBoundary": "Temporarily not automated. This statement has not yet been assessed for deterministic automation eligibility; human-only is reserved for statements later judged permanently ineligible."
            },
            {
              "statementType": "prohibitedSubstitution",
              "statement": "Do not treat the existing screening sheet as empirical proof of market validity.",
              "classification": "not-yet-automated",
              "ruleIds": [],
              "semanticCriteriaIds": [
                "segment.definition.boundary"
              ],
              "humanReviewRequired": true,
              "humanReviewQuestion": "Does the generated attempt evidence satisfy the approved policy statement through the mapped criteria (segment.definition.boundary) without relying on prohibited substitutions? Statement: Do not treat the existing screening sheet as empirical proof of market validity.",
              "automationBoundary": "Temporarily not automated. This statement has not yet been assessed for deterministic automation eligibility; human-only is reserved for statements later judged permanently ineligible."
            }
          ]
        },
        {
          "requirementId": "REQ-2",
          "statements": [
            {
              "statementType": "requiredVerificationBehavior",
              "statement": "Preserve REQ-2 as instance-scoped: one credible qualifying occurrence can establish that the behavior exists.",
              "classification": "not-yet-automated",
              "ruleIds": [],
              "semanticCriteriaIds": [
                "instance.behavior.threshold"
              ],
              "humanReviewRequired": true,
              "humanReviewQuestion": "Does the generated attempt evidence satisfy the approved policy statement through the mapped criteria (instance.behavior.threshold) without relying on prohibited substitutions? Statement: Preserve REQ-2 as instance-scoped: one credible qualifying occurrence can establish that the behavior exists.",
              "automationBoundary": "Temporarily not automated. This statement has not yet been assessed for deterministic automation eligibility; human-only is reserved for statements later judged permanently ineligible."
            },
            {
              "statementType": "requiredVerificationBehavior",
              "statement": "First validate EV-004's provenance, complete active-assembly measurement boundaries, segment fit, threshold, and supersession status; if it remains credible, it establishes instance-scoped existence.",
              "classification": "not-yet-automated",
              "ruleIds": [],
              "semanticCriteriaIds": [
                "instance.behavior.threshold",
                "supersession.open04"
              ],
              "humanReviewRequired": true,
              "humanReviewQuestion": "Does the generated attempt evidence satisfy the approved policy statement through the mapped criteria (instance.behavior.threshold, supersession.open04) without relying on prohibited substitutions? Statement: First validate EV-004's provenance, complete active-assembly measurement boundaries, segment fit, threshold, and supersession status; if it remains credible, it establishes instance-scoped existence.",
              "automationBoundary": "Temporarily not automated. This statement has not yet been assessed for deterministic automation eligibility; human-only is reserved for statements later judged permanently ineligible."
            },
            {
              "statementType": "requiredVerificationBehavior",
              "statement": "Treat measurement of further in-segment owners and reuse-versus-blank behavior as optional research into variation or recurrence; any association must not change REQ-2's status, imply causation, or invalidate the segment without separate evidence.",
              "classification": "not-yet-automated",
              "ruleIds": [],
              "semanticCriteriaIds": [
                "proposal.weekly.buckets"
              ],
              "humanReviewRequired": true,
              "humanReviewQuestion": "Does the generated attempt evidence satisfy the approved policy statement through the mapped criteria (proposal.weekly.buckets) without relying on prohibited substitutions? Statement: Treat measurement of further in-segment owners and reuse-versus-blank behavior as optional research into variation or recurrence; any association must not change REQ-2's status, imply causation, or invalidate the segment without separate evidence.",
              "automationBoundary": "Temporarily not automated. This statement has not yet been assessed for deterministic automation eligibility; human-only is reserved for statements later judged permanently ineligible."
            },
            {
              "statementType": "prohibitedSubstitution",
              "statement": "Do not require recurrence or segment-wide prevalence to pass the instance-scoped REQ-2 question.",
              "classification": "not-yet-automated",
              "ruleIds": [],
              "semanticCriteriaIds": [
                "instance.behavior.threshold",
                "proposal.weekly.buckets"
              ],
              "humanReviewRequired": true,
              "humanReviewQuestion": "Does the generated attempt evidence satisfy the approved policy statement through the mapped criteria (instance.behavior.threshold, proposal.weekly.buckets) without relying on prohibited substitutions? Statement: Do not require recurrence or segment-wide prevalence to pass the instance-scoped REQ-2 question.",
              "automationBoundary": "Temporarily not automated. This statement has not yet been assessed for deterministic automation eligibility; human-only is reserved for statements later judged permanently ineligible."
            },
            {
              "statementType": "prohibitedSubstitution",
              "statement": "Do not treat EV-003 as automatically superseding EV-002 by source identity or chronology.",
              "classification": "not-yet-automated",
              "ruleIds": [],
              "semanticCriteriaIds": [
                "supersession.open04"
              ],
              "humanReviewRequired": true,